animal_id,animal_name,gender,age,shelter_id,bio,breed_id,color,size,medical_id
43992903,Squirrel,Female,Adult,17,"My name is Squirrel, and I am a seven-year-old female coon mix. My owners were homeless off and on, so...",Domestic Medium Hair,,Medium,none
43922003,Celeste,Female,Adult,17,"My name is Celeste, and I am a sleek, petite 5-year-old girl. My foster mom thinks I didn’t get much...",Domestic Medium Hair,,Medium,none
44364138,LUCKY,Female,Adult,18,"Lucky Female 6 Months  Hi!  I&#039;m Lucky, a sweet young piggie looking for a great new home.  My owner moved...",Guinea Pig,,Small,none
44364139,LUNA,Female,Adult,18,,Domestic Short Hair,,Large,none
44364140,PESO,Male,Young,18,,Pit Bull Terrier,,Medium,none
44364141,ANGEL,Male,Senior,18,,Guinea Pig,,Small,none
44364142,BOSCO,Male,Adult,18,,Guinea Pig,,Small,none
44353871,TULIP,Female,Adult,18,,New Zealand,,Medium,none
44353872,DAMON,Male,Adult,18,,Pit Bull Terrier,,Large,none
44349981,SRIRACHA,Female,Young,18,,Chihuahua,Bicolor,Small,none
44328534,MINNIE,Female,Young,18,,Greyhound,,Medium,none
44317933,POLLUX,Male,Adult,18,"Pollux White and Gray Chinchilla 5 Years Male  Hi!  I&#039;m Pollux, a handsome chinchilla looking for a great new home....",Chinchilla,,Small,none
44306658,BASHFUL,Male,Adult,18,"Grumpy, Bashful, Doc, Dopey, and Happy Males Hamsters  Hi Ho!  We are the 7 Dwarves hamsters and we are all...",Hamster,,Small,none
44306654,DOPEY,Male,Adult,18,"Grumpy, Bashful, Doc, Dopey, and Happy Males Hamsters  Hi Ho!  We are the 7 Dwarves hamsters and we are all...",Hamster,,Small,none
44306657,DOC,Male,Adult,18,"Grumpy, Bashful, Doc, Dopey, and Happy Males Hamsters  Hi Ho!  We are the 7 Dwarves hamsters and we are all...",Hamster,,Small,none
44299448,NANA,Female,Adult,18,"Nana   **    Spayed Female   **    Age: 7 years   **    Black SH   **    A227408   **     About Me:   Hi there, my name&#039;s...",Domestic Short Hair,,Medium,none
44299449,MEOW,Unknown,Adult,18,,Cockatoo,,Small,none
44299451,AMELIA,Female,Young,18,Amelia 2 Years Spayed Female Gray Lop-English A372902  I wasn&#039;t getting along with the other rabbit in my household.    Hello!...,English Lop,,Medium,none
44296705,GRUMPY,Male,Adult,18,"Grumpy, Bashful, Doc, Dopey, and Happy Males Hamsters  Hi Ho!  We are the 7 Dwarves hamsters and we are all...",Hamster,,Small,none
44296703,PACO,Male,Adult,18,"Paco *** Neutered Male *** Age: 8 years *** Black Short Hair *** A370480 ***                                                                                More About Me: Hi there,...",Domestic Short Hair,,Medium,none
44280885,DINA,Female,Adult,18,"A372351 / Pit bull terrier / 3 years old / Spayed female /// Hi, everyone. My name is Dina and...",Pit Bull Terrier,,Medium,none
44276177,NALA,Female,Adult,18,,Pit Bull Terrier,,Medium,none
44334347,Noodles,Female,Adult,19,"Noodles and her sister Pumpkin Spice were rescued from a bad owner situation in December, and have been living with...",Tuxedo,Black & White / Tuxedo,Medium,none
44334303,Tom Brady,Male,Adult,19,"Tom Brady is a handsome fellow-- as we all know.  But this kitty, Tom is as well!  At 5 years...",Maine Coon,Tabby (Orange / Red),Large,none
44306413,Pair of shy kitten brothers,Male,Baby,19,"This pair of 4-5 month old brothers (Asher with the white feet, Felix is solid brown tiger) is still shy,...",Domestic Short Hair,Tabby (Tiger Striped),Medium,none
44259645,Shadow-- cuz he IS one!,Male,Adult,19,"Shadow is a 17 month old, 10.6 lb. healthy male tabby cat with big green eyes and a cute pink...",Tiger,Tabby (Tiger Striped),Medium,none
44223545,Amy,Female,Adult,19,"Amy is a darling gal, about 2-2.5 years old and is a love.  She is even tempered and a nice...",Domestic Short Hair,Tabby (Brown / Chocolate),Medium,none
44222443,Marnie,Female,Adult,19,This lovely little gal is only between 1 and 1 and a half years old-- and she has already been...,Tortoiseshell,Tortoiseshell,Small,none
44214380,Bear Claws,Male,Young,19,This guy has HUGE FEET-- polydactyl on all 4 paws- (Pictures of a front and  a back paw)-- all have...,Extra-Toes Cat / Hemingway Polydactyl,Tortoiseshell,Large,none
44214367,Buddy tiger,Male,Adult,19,"This guy can not get enough lovin&#039;.  He is happy to be scooped up in your arms, to be snuggled,...",Tiger,Tabby (Tiger Striped),Medium,none
44214329,Nick,Male,Adult,19,"Nick is a super sweet, typical orange boy-- big, happy, playful and snuggly.  For those of us who love our...",Tabby,Orange & White,Large,none
44165313,8 Month old kitten pairs,Male,Young,19,"This litter of 4 includes two female tiger and whites (Milly and Molly) who are sweet and easy going, and...",Domestic Short Hair,Black,Large,none
44131359,6 month old kitten pairs,Male,Baby,19,"These two handsome and sweet brothers are  just turning 6 months old. They are happy, playful and sweet and super...",Domestic Short Hair,Black,Large,none
44061635,G-boy kittens,Male,Baby,19,"Three in this litter of handsome young tigers boys-- born in a foster home to a friendly momma, these boys...",Tabby,Tabby (Brown / Chocolate),Medium,none
44060272,Jenny and Benny kitten sibs,Male,Baby,19,"Sweet, adorable, kid friendly, and happy ~ 6 month old kitten sibs want a playful, fun loving home to join....",Domestic Short Hair,Black,Small,none
44060243,Orange boys duo,Male,Adult,19,"This is a great pair of sweet 2-3 year old boys who have found one other, and made great friends....",Maine Coon,Tabby (Orange / Red),Medium,none
44007193,Latte,Female,Adult,19,This little beauty is another transfer from a large shelter overrun with kitties in need.  She is a loving beautiful...,Maine Coon,Brown / Chocolate,Medium,none
44007161,Bootsie,Male,Adult,19,"Sweet and outgoing, this is a gentle and loving boy, about 5-6 years young.  Full of playful spirit, but more...",Tiger,Tabby (Leopard / Spotted),Medium,none
44007112,Diamond,Female,Young,19,"With the somewhat exotic good looks of dark brown and shimmery gold of the Torbies, this kitty is a real...",Tiger,Tabby (Brown / Chocolate),Medium,none
44007033,Marvel and Marlow,Male,Young,19,"These two boys ( we think are bothers) were supposedly found outdoors-- though they are super friendly, and we actually...",Tiger,Buff & White,Medium,none
43916458,Little Zoey,Female,Young,19,"Little Zoey is a petite little kitten, and is almost 6 months old.  She was raised in a foster home...",Domestic Short Hair,Black,Small,none
43899425,Muffin and Puffin- Courtesy Listing,Female,Senior,19,Muffin and Puffin have been in a home together since kitten hood-- and very sadly had to see their owner...,Domestic Medium Hair,Black & White / Tuxedo,Large,none
44355037,Deke,Male,Baby,20,"There are eight puppies in this litter, so you can imagine how hard they play and how much fun they...",Labrador Retriever,Black,Medium,none
44355013,Ridge,Male,Baby,20,"There are eight puppies in this litter, so you can imagine how hard they play and how much fun they...",Labrador Retriever,Black,Medium,none
44355005,Taci,Female,Baby,20,"There are eight puppies in this litter, so you can imagine how hard they play and how much fun they...",Labrador Retriever,Black,Medium,none
44354996,Troy,Male,Baby,20,"There are eight puppies in this litter, so you can imagine how hard they play and how much fun they...",Labrador Retriever,Black,Medium,none
44327788,Lucie,Female,Baby,20,"There are eight puppies in this litter, so you can imagine how hard they play and how much fun they...",Labrador Retriever,Black,Large,none
44327765,Wes,Male,Baby,20,"DUE TO A LARGE VOLUME OF APPLICATIONS RECEIVED, WE WILL NOT BE ACCEPTING ADDITIONAL ONES FOR WES.


There are eight...",Labrador Retriever,Black,Large,none
44266046,"Jenny -Tewksbury, MA",Female,Adult,20,This little beauty is Jenny.  She is 4 years old and 51 lbs. beagle/pointer mix.  She is house trained and...,Pointer,White / Cream,Medium,none
44192012,"Blakely in Walpole, MA",Female,Young,20,Blakely is a pretty little lab mix that was born on 7/2/18 and currently weighs around 40 lbs.   She is...,Labrador Retriever,Black,Medium,none
44183806,Daisy - ADOPTION PENDING,Female,Young,20,"DUE TO A LARGE RESPONSE, WE WILL NOT BE ACCEPTING FURTHER APPLICATIONS.


This sweetie is Daisy  who is approx. 6...",Labrador Retriever,"Tricolor (Brown, Black, & White)",Medium,none
44183416,Rosie - ADOPTION PENDING,Female,Young,20,"DUE TO A LARGE RESPONSE, WE WILL NOT BE ACCEPTING FURTHER APPLICATIONS.

This beauty is Rosie who is approx. 6...",Golden Retriever,Brown / Chocolate,Medium,none
44133843,"Star - in Plymouth, MA",Female,Adult,20,"This beautiful girl was saved from a kill shelter by an elderly gentleman in December 2018, however, he has developed...",Golden Retriever,Yellow / Tan / Blond / Fawn,Large,none
44048573,Charley,Female,Young,20,"This sweet girl is Charley.  She is 7 months old  and weighs 40 lbs.  She is a great, playful puppy...",Labrador Retriever,Yellow / Tan / Blond / Fawn,Medium,none
44048472,Mandy - ADOPTION PENDING,Female,Young,20,Mandy was dumped at a business and rescued by the foster&#039;s daughter.  She was very underweight and had Demodex but...,Labrador Retriever,"Tricolor (Brown, Black, & White)",Medium,none
44048002,Ian - ADOPTION PENDING,Male,Baby,20,"Ian is such a handsome boy and a total love bug to boot! He is super sweet, very friendly and...",Labrador Retriever,Black,Large,none
43986049,Poppet,Female,Baby,20,"DUE TO A LARGE RESPONSE, WE WILL NOT BE ACCEPTING FURTHER APPLICATIONS

Poppet and her siblings are some of the...",Beagle,Brown / Chocolate,Medium,none
43985669,"Sugar - IN PEMBROKE, MA",Female,Baby,20,Sugar and her sister Cinnamon(also posted) were found by an older couple in TN who called the local rescue for...,Labrador Retriever,Yellow / Tan / Blond / Fawn,Medium,none
43980494,Chyna,Female,Adult,20,"What a little cutie pie!  Chyna is a very happy, sweet and good natured girl and she loves being with...",Chihuahua,White / Cream,Small,none
43973322,Cayenne,Male,Young,20,"Meet Cayenne, you can tell by his pictures and the look in his eyes, that he has a zest for...",Australian Cattle Dog / Blue Heeler,Red / Chestnut / Orange,Medium,none
43973299,Molly,Female,Young,20,Molly is a full blooded Australian Cattle Dog and she is absolutely beautiful with her very unique coloring…she is a...,Australian Cattle Dog / Blue Heeler,Red / Chestnut / Orange,Medium,none
43965393,Cleo - ADOPION PENDING,Female,Young,20,Cleo is a full blooded Australian Cattle Dog and she is absolutely beautiful with her very unique coloring…she is a...,Australian Cattle Dog / Blue Heeler,Red / Chestnut / Orange,Medium,none
