animal_id,animal_name,gender,age,shelter_id,bio,breed_id,color,size,medical_id
44349896,Louie - local pup,Male,Young,11,"**Please read Louie&#039;s entire profile, which includes a link to the adoption application. Thank you!** 

Meet Louie - a 2...",Beagle,White / Cream,Small,none
44339054,Barney,Male,Baby,11,"**Please read ***&#039;s entire profile, which includes a link to the adoption application. Thank you!** 
Hi, I&#039;m Bart. I&#039;m a...",Dachshund,Yellow / Tan / Blond / Fawn,Small,none
44339031,Skinner,Male,Baby,11,"**Please read ***&#039;s entire profile, which includes a link to the adoption application. Thank you!** 
Hi, I&#039;m Bart. I&#039;m a...",Dachshund,Yellow / Tan / Blond / Fawn,Small,none
44338992,Selma,Female,Baby,11,"**Please read ***&#039;s entire profile, which includes a link to the adoption application. Thank you!** 
Hi, I&#039;m Selma. I&#039;m a...",Dachshund,Yellow / Tan / Blond / Fawn,Small,none
44338979,Nelson,Male,Baby,11,"**Please read ***&#039;s entire profile, which includes a link to the adoption application. Thank you!** 
Hi, I&#039;m Nelson. I&#039;m a...",Dachshund,Yellow / Tan / Blond / Fawn,Small,none
44338969,Marge,Female,Baby,11,"**Please read ***&#039;s entire profile, which includes a link to the adoption application. Thank you!** 
Hi, I&#039;m Marge. I&#039;m a...",Dachshund,Yellow / Tan / Blond / Fawn,Small,none
44338920,Lisa,Female,Baby,11,"**Please read ***&#039;s entire profile, which includes a link to the adoption application. Thank you!** 
Hi, I&#039;m Lisa. I&#039;m a...",Dachshund,Yellow / Tan / Blond / Fawn,Small,none
44338897,Ned,Male,Baby,11,"**Please read ***&#039;s entire profile, which includes a link to the adoption application. Thank you!** 
Hi, I&#039;m Ned. I&#039;m a...",Dachshund,Yellow / Tan / Blond / Fawn,Small,none
44338886,Millhouse,Male,Baby,11,"**Please read ***&#039;s entire profile, which includes a link to the adoption application. Thank you!** 
Hi, I&#039;m Millhouse. I&#039;m a...",Dachshund,Yellow / Tan / Blond / Fawn,Small,none
44338874,Homer,Male,Baby,11,"**Please read ***&#039;s entire profile, which includes a link to the adoption application. Thank you!** 
Hi, I&#039;m Homer. I&#039;m a...",Dachshund,Yellow / Tan / Blond / Fawn,Small,none
44338867,Cathy,Female,Baby,11,"**Please read ***&#039;s entire profile, which includes a link to the adoption application. Thank you!** 
Hi, I&#039;m Cathy. I&#039;m a...",Dachshund,Yellow / Tan / Blond / Fawn,Small,none
44337203,Bart,Male,Baby,11,"**Please read ***&#039;s entire profile, which includes a link to the adoption application. Thank you!** 
Hi, I&#039;m Bart. I&#039;m a...",Dachshund,Yellow / Tan / Blond / Fawn,Small,none
44335620,Bella Mason,Female,Young,11,"**Please read ***&#039;s entire profile, which includes a link to the adoption application. Thank you!** 
Hi, I&#039;m Bella Mason and...",Jack Russell Terrier,Harlequin,Small,none
44334262,Mindy,Female,Senior,11,"**Please read ***&#039;s entire profile, which includes a link to the adoption application. Thank you!** 

Good morning, Let me introduce...",Hound,Golden,Large,none
44334143,Marley,Female,Young,11,"**Please read ***&#039;s entire profile, which includes a link to the adoption application. Thank you!** 
Hi, I&#039;m Marley, a Labador...",Labrador Retriever,Golden,Large,none
44357507,Harvey,Male,Young,12,"You can fill out an adoption application online on our official website.Please contact PittieLove Rescue, Inc. (info@pittieloverescue.org) for more information...",Pit Bull Terrier,,Medium,none
44332279,Tom Brady n/ Apache,Male,Baby,12,You can fill out an adoption application online on our official website.Adoption Fee: $400&amp;#10;Our information is current if you are...,Pit Bull Terrier,,Medium,none
44313809,Donnie,Male,Adult,12,You can fill out an adoption application online on our official website.Adoption Fee: $325&amp;#10;Our information is current if you are...,Pit Bull Terrier,,Medium,none
44296452,Dont'a Hightower n/ Gepetto,Male,Baby,12,You can fill out an adoption application online on our official website.Adoption Fee: $400&amp;#10;&amp;#10;Our information is current if you are...,Pit Bull Terrier,,Medium,none
44259152,Benjamin Button,Male,Young,12,You can fill out an adoption application online on our official website.Adoption Fee: $325&amp;#10;&amp;#10;Our information is current if you are...,Pit Bull Terrier,,Medium,none
44259153,Joy n/Jolene,Female,Baby,12,You can fill out an adoption application online on our official website.Adoption Fee: $400&amp;#10;&amp;#10;Our information is current if you are...,Pit Bull Terrier,,Medium,none
44251861,Julian Edelman n/ Nico,Male,Baby,12,You can fill out an adoption application online on our official website.Adoption Fee: $400&amp;#10;Our information is current if you are...,Pit Bull Terrier,,Medium,none
44224543,Betty,Female,Young,12,"You can fill out an adoption application online on our official website.&amp;#10;PittieLove Rescue, Inc. a 501c3 orgainization is an all-volunteer,...",Pit Bull Terrier,,Medium,none
44213439,Kiwi,Female,Young,12,You can fill out an adoption application online on our official website.Adoption Fee: $325&amp;#10;Our information is current if you are...,Pit Bull Terrier,,Medium,none
44198939,Tuna n/ Lola,Female,Senior,12,You can fill out an adoption application online on our official website.Adoption Fee: $325&amp;#10;Our information is current if you are...,Pit Bull Terrier,,Medium,none
44153662,Jingle,Male,Baby,12,You can fill out an adoption application online on our official website.Adoption Fee: $400&amp;#10;Our information is current if you are...,Pit Bull Terrier,,Medium,none
44098285,Sully n/ Dozer,Male,Young,12,You can fill out an adoption application online on our official website.Adoption Fee: $325&amp;#10;&amp;#10;Our information is current if you are...,Pit Bull Terrier,,Medium,none
44014661,Lillie,Female,Young,12,"You can fill out an adoption application online on our official website.&amp;#10;PittieLove Rescue, Inc. a 501c3 orgainization is an all-volunteer,...",Pit Bull Terrier,,Medium,none
43995305,Gabby,Female,Young,12,You can fill out an adoption application online on our official website.Adoption Fee: $325&amp;#10;&amp;#10;Our information is current if you are...,Pit Bull Terrier,,Medium,none
43968090,Eve,Female,Young,12,"You can fill out an adoption application online on our official website.Please contact PittieLove Rescue, Inc. (info@pittieloverescue.org) for more information...",Pit Bull Terrier,,Medium,none
43936357,Nova,Female,Young,12,You can fill out an adoption application online on our official website.Adoption Fee: $325&amp;#10;Our information is current if you are...,Pit Bull Terrier,,Medium,none
43936356,Melody,Female,Adult,12,"You can fill out an adoption application online on our official website.Please contact PittieLove Rescue, Inc. (info@pittieloverescue.org) for more information...",Pit Bull Terrier,,Medium,none
43874809,Jimmie,Male,Baby,12,You can fill out an adoption application online on our official website.Adoption Fee: $400&amp;#10;&amp;#10;Our information is current if you are...,Pit Bull Terrier,,Medium,none
43874810,Skipper n/ Carson,Male,Young,12,You can fill out an adoption application online on our official website.Adoption Fee: $400&amp;#10;&amp;#10;Our information is current if you are...,Pit Bull Terrier,,Medium,none
43833054,Ronnie n/ Elsa,Female,Baby,12,You can fill out an adoption application online on our official website.Adoption Fee: $400&amp;#10;&amp;#10;Our information is current if you are...,Pit Bull Terrier,,Medium,none
43758569,Onyx,Male,Baby,13,Onyx has been in foster care for 6 months now (born July 2018) and he has come so far from...,Domestic Short Hair,Black,Medium,none
43707958,Tula,Female,Baby,13,"Hi, I&#039;m Tula. I&#039;m a little Tuxedo kitten who was rescued and am now living in a foster home. I&#039;ve...",Domestic Short Hair,Black & White / Tuxedo,Medium,none
43693820,Hemingway,Male,Adult,13,"Hemingway is fully vetted, healthy and neutered cat. At about 1.5 years old, he’s a lap cat and loves hanging...",Domestic Long Hair,Black & White / Tuxedo,Medium,none
43511784,Pacino,Male,Adult,13,"Hi, my name is Pacino.  I am your best buddy.  I am a very handsome short-haired, neutered male tuxedo cat....",Domestic Short Hair,Black & White / Tuxedo,Medium,none
43324578,Olivia,Female,Baby,13,"Olivia and her sister Olissa, were born to a feral mother but were captured when they were just a few...",Domestic Short Hair,Black & White / Tuxedo,Medium,none
43324528,Olissa,Female,Baby,13,"Olissa and her sister, Olivia, were born to a feral mother but were captured when they were just a few...",Domestic Short Hair,Black,Medium,none
43306302,Bootsie,Female,Adult,13,I am a beautiful gray and beige dilute spayed tabby.  I was born in 2009 and weigh about 12 lbs....,Domestic Short Hair,Dilute Calico,Medium,none
43198598,Odessa,Female,Baby,13,"Hi my name is Odessa.  I am a pretty female kitten, solid black with two white patches on my belly....",Domestic Short Hair,Black & White / Tuxedo,Medium,none
43198588,Oliver,Male,Baby,13,"Hi, my name is Oliver.  I am a double-pawed male kitten, solid black with white crescent under my chin. My...",Domestic Short Hair,Black & White / Tuxedo,Medium,none
43029164,Luna,Female,Adult,13,"Luna was adopted from BCCC with Zoe, a solid gray shorthair, several years ago. Due to a life change, their...",Domestic Short Hair,Tabby (Gray / Blue / Silver),Medium,none
43029202,Zoe,Female,Adult,13,"Zoe was adopted from BCCC with Luna, a gray tabby, several years ago. Due to a life change, their guardian...",Domestic Medium Hair,Gray / Blue / Silver,Medium,none
42856653,Stormy,Female,Adult,13,"I am Stormy.  I am a beautiful spayed tuxedo female with a big fluffy, curly tail. I was born in...",Tuxedo,Black & White / Tuxedo,Medium,none
42856678,Ralphie,Male,Adult,13,"I am Ralphie. I am a playful, handsome, short-haired, neutered tuxedo male.  I was born in 2017 and weigh about...",Tuxedo,Black & White / Tuxedo,Medium,none
42477758,Addy,Female,Baby,13,Addy is a highly energetic kitten who would be best suited to an active household! She and her sister Heidi...,Domestic Short Hair,Orange / Red,Medium,none
42477873,Heidi,Female,Baby,13,Heidi is a picture perfect kitten. She loves to be held and snuggled like a baby. She and her sister...,Domestic Short Hair,Black,Medium,none
42406532,Minnie,Female,Baby,13,Minnie is an adorable domestic short-hair kitten. She was born late May/early June 2018. She is a tortie with an...,Domestic Short Hair,Tortoiseshell,Medium,none
41924638,Neon,Male,Baby,13,"Hi my name is Neon. I am a flashy little fellow born on or around May 1, 2018. I am...",Domestic Medium Hair,Black & White / Tuxedo,Medium,none
41876818,HuggyBear,Male,Baby,13,"Huggy is the quintessential kitten. He’s sweet and energetic, and only wants to be where his people are. He loves...",Domestic Short Hair,Black,Medium,none
41689436,Gronk,Male,Young,13,"My name is Gronk. I am a small (7lb), black, long-haired, neutered male. I was born in 2017. I am...",Domestic Long Hair,Black,Medium,none
41647022,Spice,Female,Young,13,Spice was surrendered to her foster home in the fall of 2017 at the approximate age of 4 months. She...,Domestic Short Hair,Tabby (Buff / Tan / Fawn),Medium,none
44356077,Cinna,Male,Young,14,"COURTESY POST - PLEASE CONCAT MARY LOU FOR FASTER RESPONSE.
maryloumaria@yahoo.com

Hi! My name is Cinna! I’m a 3-year old,...",Boxer,Brindle,Medium,none
44326274,Domino,Male,Young,14,"COURTESY POST - CONTACT MARY LOU FOR QUICKER RESPONSE AT
maryloumaria@yahoo.com

My name is Domino, and I’m two years old....",American Staffordshire Terrier,,Medium,none
44253664,Frank,Male,Young,14,"THIS IS A COURTESY POST. PLEASE DO NOT CONTACT MASSPAWS. SEE DETAILS BELOW	
Frank, aka ? &quot;Frank the Tank&quot;, Francis,...",Pit Bull Terrier,Gray / Blue / Silver,Large,none
44186046,Gigi,Female,Young,14,"I am a beautiful grey bully with piercing amber eyes. 
I weigh in at 70 lbs-short and beefy.

I am...",American Staffordshire Terrier,,Large,none
44160290,Samson,Male,Young,14,"COURTESY POST - FOR QUICKER REPLY PLEASE CONTACT MARY LOU AT
maryloumaria@yahoo.com


Hello! My name is Samson, but I also...",American Bulldog,Brown / Chocolate,Medium,none
44105270,Govenor,Male,Adult,14,"COURTESY POST - FOR QUICKER RESPONSE CONTACT MARY LOU AT maryloumaria@yahoo.com

FOSTER AND/OR ADOPTER NEEDED ASAP!!

‘Ello, Governor! My name...",Labrador Retriever,,Medium,none
44105266,Moose,Male,Young,14,"COURTESY POST - for quicker response please contact maryloumaria@yahoo.com for an application.

My name is Moose, and I’m a shepherd...",Shepherd,Apricot / Beige,Medium,none
44070075,Cooper,Male,Adult,14,"COURTESY POST

Hi! My name is Cooper and I’m a 4-year old Siberian Husky mix.

I’m proud to say I...",Siberian Husky,,Medium,none
44059379,Nakita,Female,Young,14,"COURTESY POST 

Nakita: 3 yrs, 42-lb, sweet, fun pittie mix needs home, love, &amp; time to destress after months in...",Pit Bull Terrier,Black,Medium,none
44049256,Newman,Male,Adult,14,"Newman is 4 years old neutered and up-to-date on vaccinations. About 55 lbs   Not cat tested, no children under 10....",Pit Bull Terrier,Brindle,Medium,none
44049073,Bubba,Male,Young,14,"COURTESY POST. DO NOT CONTACT MASSPAWS.

My name is Bubba and I am a 3 year old Beagle looking for...",Beagle,"Tricolor (Brown, Black, & White)",Medium,none
43935735,Frankie,Male,Young,14,"COURTESY POST - FOR QUICKER RESPONSE EMAIL Mary Lou at maryloumaria@yahoo.com

I’m Frankie and I am a survivor.  

I was...",American Staffordshire Terrier,Gray / Blue / Silver,Medium,none
43875761,Hippo,Male,Adult,14,"COURTESY POST - FOR QUICKER INFORMATION PLEASE CONTACT MARY LOU AT maryloumaria@yahoo.com

Our &quot;blue nose meatballs&quot; are temporarily SAFE with...",American Staffordshire Terrier,,Large,none
43875741,Moose,Male,Adult,14,"COURTESY POST - FOR QUICKER INFORMATION PLEASE CONTACT MARY LOU AT maryloumaria@yahoo.com

Our &quot;blue nose meatballs&quot; are temporarily SAFE with...",American Staffordshire Terrier,,Large,none
43766693,Java,Female,Adult,14,"COURTESY POST - FOR QUICKER RESPONSE PLEASE CONTACT MARY LOU AT maryloumaria@yahoo.com or PAM AT pamjohnson.ark@gmail.com

Needs A Home With...",Terrier,Brindle,Medium,none
43725117,Leo,Male,Adult,14,"COURTESY POST - FOR QUICKER RESPONSE PLEASE EMAIL MARY LOU AT maryloumaria@yahoo.com or PAM at pamjohnson.ark@gmail.com

Leo is a lovable...",Labrador Retriever,Black,Large,none
43660060,Godiva,Female,Adult,14,"COURTESY POST for quicker response please email Diane at dianeswift.ark@gmail.com

MEET GODIVA! She’s a 3-year old, 60-lb spayed female in...",Labrador Retriever,Black,Medium,none
43617111,Bentley,Male,Adult,14,"COURTESY POST - FOR QUICKER RESPONSE CONTACT PAM AT pamjohnson.ark@gmail.com OR MARY LOU AT maryloumaria@yahoo.com

I AM A CANCER SURVIVOR...",Doberman Pinscher,Red / Chestnut / Orange,Large,none
43561480,Teddy,Male,Adult,14,"COURTESY POST - FOR QUICKER RESPONSE PLEASE CONTACT PAM AT pamjohnson.ark@gmail.com or MARY LOU AT maryloumaria@yahoo.com

We are looking for...",Collie,"Tricolor (Brown, Black, & White)",Medium,none
43347021,Frankie,Male,Young,14,"COURTESY POST - FOR QUICKER REPLY PLEASE EMAIL PAM AT bearfan54.pj@gmail.com or MARY LOU AT maryloumaria@yahoo.com

Do you know what...",American Staffordshire Terrier,White / Cream,Medium,none
44327503,Hazel,Female,Young,15,"Hazel is a young cat, just over 2 years old.  She starts out shy in new situations but will warm...",Domestic Long Hair,Tabby (Brown / Chocolate),Medium,none
44284639,Whiskey,Female,Young,15,"Whiskey came to us on St. Patrick&#039;s day, which is how she got her name!  She is shy in new...",Tortoiseshell,,Medium,none
44159517,Juneau,Female,Baby,15,Juneau is a young shy kitten. She had a rough start and needs an experienced quiet home. She looks to...,Siamese,Seal Point,Medium,none
44159491,Shepherd,Male,Young,15,"Shepherd is a shy boy who will take a little time to warm up, but once he&#039;s comfortable you get...",Domestic Short Hair,Black & White / Tuxedo,Medium,none
44098815,Ryder,Male,Baby,15,Ryder is a young cat only about 6-7 months old. He needs to be with another kitten or young cat...,Domestic Short Hair,,Medium,none
44098792,Sumo,Male,Young,15,"Sumo is a shy boy who is still learning to trust people.  Even though he&#039;s still so unsure, he&#039;s very...",Domestic Short Hair,Orange / Red,Medium,none
43797805,Whistler,Female,Baby,15,"Whistler is a very sweet girl who was rescued right before this winter&#039;s first major snow storm.  Lucky for her,...",Tabby,,Medium,none
43769830,The Breakfast Bunch,Male,Baby,15,"Meet the Breakfast Bunch: Eggo, Omlette, Strudel (girls), Pancake &amp; Espresso (boys)!  We are very playful and active in our...",Domestic Short Hair,,Medium,none
43739800,Brazil,Male,Adult,15,"This handsome boy is the biggest love bug!  Brazil is a young adult cat, about 6 years old.  He LOVES...",Domestic Short Hair,Gray & White,Large,none
43669368,Acorn,Female,Young,15,Acorn is a sweet but shy girl who is looking for a forever home that will spoil her. People were...,Tortoiseshell,,Medium,none
43567928,Benedict,Male,Baby,15,"Benedict is a very shy boy that needs a nice, quiet home that will give him time to blossom.  He...",Domestic Short Hair,,Medium,none
43408265,Harvest,Male,Baby,15,"Harvest is a handsome, chatty, outgoing older kitten that is looking for a stable home where he can feel safe....",Domestic Short Hair,Orange & White,Medium,none
43384938,Cranberry,Female,Baby,15,"Cranberry is a sweet, young girl that needs a lot of attention.  She loves people but can be shy in...",Domestic Short Hair,,Medium,none
42891347,Emerson,Male,Young,15,"Emerson is a friendly, high energy cat that loves to run and play. He gets along with other playful cats...",Domestic Short Hair,Gray / Blue / Silver,Medium,none
42891323,Macadamia,Female,Young,15,"Macadamia is very sweet and loves people, but can be sensitive to stressful situations and loud environments. She would do...",Domestic Short Hair,Tabby (Brown / Chocolate),Small,none
42891304,Gooseberry,Female,Young,15,"Gooseberry is a shy girl until she gets to know you, but once she warms up she’s very sweet and...",Domestic Short Hair,Tabby (Brown / Chocolate),Medium,none
42523768,Pecan,Female,Young,15,"Pecan is a cute, exotic looking, young cat that loves to be around her people!  She is a friendly girl...",Tabby,,Medium,none
42417446,Walnut,Male,Young,15,"Walnut is a friendly, vocal cat that loves attention. Looking for a nosey cat that wants to be in the...",Domestic Short Hair,Black,Medium,none
42399719,Pistachio,Male,Baby,15,"Pistachio is a sweet, friendly boy looking for a home with another young, playful cat or kitten.  He&#039;s nervous in...",Domestic Short Hair,Black & White / Tuxedo,Medium,none
42260840,Rue,Female,Baby,15,"Raisin, Rue, Ripple &amp; Regina are sweet, active kittens looking for an experienced home that will give them time to...",Domestic Long Hair,Tabby (Brown / Chocolate),Medium,none
44362802,Sam,Male,Senior,16,"Adoption coordinator Kathy 

Meet Sam! He’s 8 yrs old and weighs 40 lbs. His owner had to surrender him due...",Beagle,,Medium,none
44355207,Shaggy,Male,Young,16,"Shaggy is an 11 month old plot hound mix, weighing close to 50 pounds.  He is a very sweet pup,...",Plott Hound,Brindle,Medium,none
44345441,Bella,Female,Adult,16,"Adoption coordinator Kathy 

Meet Bella! She’s a beautiful hound mix who is 2 yrs old and 60lbs. Her owner passed...",Hound,,Medium,none
44345357,Scotty,Male,Adult,16,"Adoption coordinator Kathy 

Meet Scotty! He’s a sweet mixed breed dog who is 1 yr old and weighs 31 lbs....",Jack Russell Terrier,,Medium,none
44339323,Buddy Roo,Male,Adult,16,"Adoption Coordinator - Carol

Buddy Roo is a great Shepherd mix weighing 52 lbs at a 1.5 years  old.  He...",Shepherd,Yellow / Tan / Blond / Fawn,Medium,none
44333662,Cinder,Female,Baby,16,Cinder is a 4-5 month-old Shepherd mix puppy.  She is a very smart pup with an adorable personality. Cinder&#039;s foster...,Shepherd,White / Cream,Medium,none
44314854,Ruby,Female,Senior,16,"Adoption coordinator Kathy 

Meet Ruby! She’s 8 yrs old and weighs 25 lbs. She was pulled from a shelter in...",Beagle,,Medium,none
44314843,Billy Beagle,Male,Adult,16,"Adoption coordinator Kathy 

Meet Billy! He’s an energetic beagle boy who is 5 yrs old and weighs 24 lbs. He...",Beagle,,Medium,none
44314829,Hope,Female,Adult,16,"Adoption coordinator Kathy 

Meet Hope! She’s a sweet and calm girl who is 5.5 yrs old and weighs 34 lbs....",Beagle,,Medium,none
44311083,Trixie,Female,Adult,16,"Coordinator:  LK

This big, beautiful girl is Trixie.  She is believed to be approximately 3 years old, of Lab mix...",Labrador Retriever,,Large,none
44311038,Annie Mae,Female,Young,16,"Coordinator:  LK

Lady luck was on Annie Mae&#039;s side when a pest control employee noticed a sad dog tied to...",Hound,Yellow / Tan / Blond / Fawn,Medium,none
44300196,Toby,Male,Baby,16,"Toby is 3 months old  and weighs 15 lbs.
Coordinator is Barrie

Siblings Toby, Mocha, Katie and Lori are looking...",Labrador Retriever,Golden,Medium,none
44300167,Mocha--PENDING,Male,Baby,16,"Mocha has found his forever home in Worcester, MA with Samuel &amp; Laura S.

Mocha  is 3 months old  and...",Labrador Retriever,Golden,Medium,none
44293186,Sally--PENDING,Female,Baby,16,"Sally has found her forever home in No. Atlleboro, MA with Ryan P.

Sally is 4 months old and weighs...",Boxer,Brindle,Medium,none
44276974,Zelda,Female,Baby,16,"The &quot; Z litter&quot; are 4 month old lab mixes: Zach and Zander are the males,  Zoey, Zelda and Zenith...",Labrador Retriever,Black,Large,none
44276965,Zoey,Female,Baby,16,"The &quot; Z litter&quot; are 4 month old lab mixes: Zach and Zander are the males,  Zoey, Zelda and Zenith...",Labrador Retriever,Black,Medium,none
44276951,Zander,Male,Baby,16,"The &quot; Z litter&quot; are 4 month old lab mixes: Zach and Zander are the males,  Zoey, Zelda and Zenith...",Labrador Retriever,,Large,none
44276912,Zach,Male,Baby,16,"The &quot; Z litter&quot; are 4 month old lab mixes: Zach and Zander are the males,  Zoey, Zelda and Zenith...",Labrador Retriever,Black,Medium,none
44276827,Franny,Female,Baby,16,"Franny has found her forever home in Sterling, MA with Maggie &amp; Faith L.

Franny is on her way to...",Labrador Retriever,Black,Medium,none
44276814,Froyd,Male,Baby,16,"Froyd has found his forever home in West Hatfield, MA with Melissa and Rebecca Z.

Adoption Coordinator - Carol

Meet...",Labrador Retriever,Black,Medium,none
44355242,Rex,Male,Adult,17,"My name is Rex, I am a handsome two-year-old male tuxedo cat. I am very friendly and well adjusted. I...",Tuxedo,,Medium,none
44355237,Billie Holiday,Female,Senior,17,"My name is Billie Holiday, and I am a very pretty 14-year-old calico. Fortunately, someone was nearby when they heard...",Domestic Medium Hair,,Medium,none
44330284,Ramona,Female,Adult,17,"My name is Ramona, and I am an extremely friendly and affectionate female FIV positive cat. I need someone that...",Domestic Medium Hair,,Medium,none
44330088,Leah,Female,Young,17,"My name is Leah, and I am a six month old blue-gray girl. I am very friendly and love being...",Domestic Medium Hair,,Medium,none
44330034,Glinda,Female,Adult,17,"My name is Glinda, and I am a very beautiful 2 year old female. I was living on the streets,...",Domestic Long Hair,,Medium,none
44315572,Jack,Male,Adult,17,"My name is Jack, and I am a very friendly and gentle 10-year-old male. My owner could no longer keep...",Domestic Medium Hair,,Medium,none
44315560,Cinnamon and Basil,Female,Adult,17,"Hi, we’re Cinnamon and Basil, two cats that are bonded for life.  We’re both very friendly and still young, about...",Domestic Medium Hair,,Medium,none
44315558,Zoe,Female,Senior,17,"My name is Zoe, and I am a friendly and sweet 13-year-old female calliby.  Sadly, I lost my home and...",Domestic Medium Hair,,Medium,none
44315524,Stellora,Female,Adult,17,"My name is Stellora, and I am a 1.5-year-old female caliby. I am very friendly and love having your attention.",Domestic Medium Hair,,Medium,none
44315501,Guinness,Male,Adult,17,"My name is Guinness, and I am a very handsome and friendly two-year-old male. My owner moved away and left...",Domestic Medium Hair,,Medium,none
44315469,JD,Male,Adult,17,My name is JD and I am a two-year-old male. I am extremely friendly and lovable. I love to play...,Domestic Medium Hair,,Medium,none
44042608,Nirvana,Female,Young,17,"Hello, my name is Nirvana and I am a 6 month old kitten looking for my forever home. My foster...",Domestic Medium Hair,,Medium,none
44042586,Kale,Male,Young,17,"Hi, my name is Kale, and I am a sweet, playful 6-month-old girl. I am very active, and love to...",Domestic Medium Hair,,Medium,none
44042565,Isabelle,Female,Senior,17,"My name is Isabelle, and I am a beautiful 11-year-old female. I come from a home with another housemate, Gizmo,...",Domestic Medium Hair,,Medium,none
44042532,Gizmo,Male,Senior,17,"My name is Gizmo, and I’m a 14 yr old male cat who was surrendered with Isabelle. I’m friendly and...",Domestic Medium Hair,,Medium,none
44042466,Fontina,Female,Adult,17,"My name is Fontina and I’m a cuddly three-year-old girl. I love, love, love to be petted and if I...",Domestic Medium Hair,,Medium,none
43992938,Bandit,Male,Adult,17,My name is Bandit and I am a 6-1/2-year-old male. My owner passed away and another elderly person took me...,Domestic Medium Hair,,Medium,none
43992919,Elton,Male,Adult,17,"My name is Elton, and I am a six-year-old male. My owner moved away and left me behind. Someone found...",Domestic Medium Hair,,Medium,none
